{
  "$schema": "./017_ENTERPRISE_ASSURANCE_DECISION_REGISTRY.schema.json",
  "registryId": "GAEP-REG-017",
  "version": "1.0.0",
  "schemaVersion": "1.0.0",
  "status": "candidate-unaccepted",
  "reviewedAt": "2026-08-09",
  "authorityBoundary": "This registry supports bounded evaluation. It does not establish GAEP acceptance, superiority, conformance, certification, enterprise readiness, safety, compliance, release, or production authority.",
  "evidenceDepthLevels": [
    { "depthId": "ED0", "label": "Identity only", "requiredEvidence": ["Known title or URL"], "permittedUses": ["Candidate identity"], "prohibitedUses": ["Scope conclusion", "Normative mapping", "Conformance", "Implementation claim", "Enterprise selection conclusion"] },
    { "depthId": "ED1", "label": "Official metadata or abstract reviewed", "requiredEvidence": ["Official identity, edition, status, scope, and abstract/metadata"], "permittedUses": ["Identity", "Scope signal", "Candidate classification", "Revision watch"], "prohibitedUses": ["Normative control mapping", "Conformance assessment", "Detailed methodology claim", "GAEP implementation claim", "Enterprise selection conclusion"] },
    { "depthId": "ED2", "label": "Substantive authoritative content reviewed", "requiredEvidence": ["Legitimate access basis", "Exact edition", "Clause/section locators", "Review coverage", "Reviewer", "Limitations"], "permittedUses": ["Bounded substantive interpretation", "Candidate control outcomes"], "prohibitedUses": ["Automatic GAEP implementation claim", "Automatic conformance"] },
    { "depthId": "ED3", "label": "GAEP control mapping established", "requiredEvidence": ["ED2", "Mapped lifecycle behavior", "Canonical contract", "Expected repository/runtime evidence", "Explicit gaps"], "permittedUses": ["Design/control mapping", "Implementation verification plan"], "prohibitedUses": ["Claim that mapped behavior exists", "Conformance"] },
    { "depthId": "ED4", "label": "Implementation evidence verified", "requiredEvidence": ["ED3", "Code/tests/generated artifact or controlled runtime evidence", "Verification method/date", "Limitations/counter-evidence"], "permittedUses": ["Bounded test-verified or runtime-verified GAEP claim"], "prohibitedUses": ["Universal assurance", "Certification", "Conformance"] },
    { "depthId": "ED5", "label": "Independently assured in a bounded context", "requiredEvidence": ["ED4", "Independent reviewer", "Defined scope", "Assurance criteria", "Findings/disposition"], "permittedUses": ["Bounded independently verified claim"], "prohibitedUses": ["Universal conformance", "Certification unless separately authorized"] }
  ],
  "referenceDepthAssessments": [
    { "referenceId": "GAEP-XREF-001", "evidenceDepth": "ED2", "reviewedCoverage": "Official publication reviewed; current edition is under revision.", "currentGaepMapping": "Concern calibration only; no normative control crosswalk.", "implementationEvidence": "Not established through this reference.", "assuranceState": "not-independently-assured", "residualGap": "Clause-level GAEP mapping and successor review remain absent.", "adoptionConsequence": "Use for bounded AI risk framing; verify successor before enterprise reliance." },
    { "referenceId": "GAEP-XREF-002", "evidenceDepth": "ED2", "reviewedCoverage": "Official generative-AI profile publication reviewed.", "currentGaepMapping": "Concern calibration; detailed control mapping remains proposed.", "implementationEvidence": "Not established through this reference.", "assuranceState": "not-independently-assured", "residualGap": "No ED3 lifecycle/control mapping.", "adoptionConsequence": "Pilot must validate GenAI risk controls against actual GAEP evidence." },
    { "referenceId": "GAEP-XREF-004", "evidenceDepth": "ED2", "reviewedCoverage": "Official SSDF publication reviewed.", "currentGaepMapping": "Secure-development concern calibration; not a practice-by-practice mapping.", "implementationEvidence": "Not established through this reference.", "assuranceState": "not-independently-assured", "residualGap": "ED3/ED4 secure-development mapping absent.", "adoptionConsequence": "Do not infer SSDF conformance; require repository/pipeline evidence in pilot." },
    { "referenceId": "GAEP-XREF-005", "evidenceDepth": "ED1", "reviewedCoverage": "Official metadata and abstract only.", "currentGaepMapping": "No normative product-quality mapping established.", "implementationEvidence": "Not established.", "assuranceState": "insufficient-evidence", "residualGap": "Licensed substantive review and control mapping absent.", "adoptionConsequence": "Identity/scope signal only; insufficient for enterprise quality conclusion." },
    { "referenceId": "GAEP-XREF-011", "evidenceDepth": "ED1", "reviewedCoverage": "Official metadata and abstract only.", "currentGaepMapping": "No normative architecture-description mapping established.", "implementationEvidence": "Not established.", "assuranceState": "insufficient-evidence", "residualGap": "Licensed substantive review and ED3 mapping absent.", "adoptionConsequence": "Do not claim architecture-description conformance." },
    { "referenceId": "GAEP-XREF-012", "evidenceDepth": "ED1", "reviewedCoverage": "Official metadata and abstract only; 2018 Edition 2 is current at lifecycle stage 90.92 and marked to be revised; Edition 3 DIS is a distinct successor draft under development.", "currentGaepMapping": "Normative GAEP requirements mapping not established.", "implementationEvidence": "Not established.", "assuranceState": "insufficient-evidence", "residualGap": "Paid substantive content was not accessed; current and successor must be reviewed separately.", "adoptionConsequence": "Permitted only for identity, scope/applicability signal, and revision watch; insufficient decision evidence." },
    { "referenceId": "GAEP-XREF-013", "evidenceDepth": "ED1", "reviewedCoverage": "Official metadata and abstract only.", "currentGaepMapping": "No lifecycle-process control mapping established.", "implementationEvidence": "Not established.", "assuranceState": "insufficient-evidence", "residualGap": "Licensed substantive review absent.", "adoptionConsequence": "Cannot support a lifecycle conformance or maturity claim." },
    { "referenceId": "GAEP-XREF-015", "evidenceDepth": "ED2", "reviewedCoverage": "Full official Recommendation and conformance sections reviewed; not criterion-by-criterion mapped.", "currentGaepMapping": "Accessibility concern calibration only.", "implementationEvidence": "Repository accessibility tests are separate evidence and require exact mapping.", "assuranceState": "not-independently-assured", "residualGap": "Criterion-level ED3 mapping and scoped assurance absent.", "adoptionConsequence": "Require product-specific accessibility evaluation; do not claim WCAG conformance." },
    { "referenceId": "GAEP-XREF-020", "evidenceDepth": "ED1", "reviewedCoverage": "Official metadata and abstract only.", "currentGaepMapping": "No normative system-lifecycle mapping established.", "implementationEvidence": "Not established.", "assuranceState": "insufficient-evidence", "residualGap": "Licensed substantive review absent.", "adoptionConsequence": "Identity/scope signal only." },
    { "referenceId": "GAEP-XREF-021", "evidenceDepth": "ED1", "reviewedCoverage": "Official summary/metadata reviewed, not complete licensed standard content.", "currentGaepMapping": "Architecture-governance concepts remain bounded adaptations.", "implementationEvidence": "Not established through TOGAF reference.", "assuranceState": "insufficient-evidence", "residualGap": "Detailed method/control mapping absent.", "adoptionConsequence": "Do not infer TOGAF implementation or conformance." },
    { "referenceId": "GAEP-XREF-022", "evidenceDepth": "ED2", "reviewedCoverage": "Full official living source reviewed.", "currentGaepMapping": "Visual architecture concern calibration; no mandated diagram set.", "implementationEvidence": "Generated diagrams/tests are separate repository evidence.", "assuranceState": "not-independently-assured", "residualGap": "No ED3 formal control mapping required unless relied on for an enterprise claim.", "adoptionConsequence": "Use as a visualization approach, not an authority framework." },
    { "referenceId": "GAEP-XREF-023", "evidenceDepth": "ED2", "reviewedCoverage": "Full primary manifesto and principles reviewed.", "currentGaepMapping": "Adapted collaboration/change principles only.", "implementationEvidence": "Not established through reference.", "assuranceState": "not-independently-assured", "residualGap": "No implementation outcome assurance.", "adoptionConsequence": "Do not equate reference with agility or delivery performance." },
    { "referenceId": "GAEP-XREF-024", "evidenceDepth": "ED2", "reviewedCoverage": "Official living delivery-performance guidance reviewed.", "currentGaepMapping": "Target operational measurement concern only.", "implementationEvidence": "Current runtime does not implement DORA measurement.", "assuranceState": "not-established", "residualGap": "Target-only measurement/operations implementation.", "adoptionConsequence": "Pilot may define DORA-like measures; Guide must not claim current capability." },
    { "referenceId": "GAEP-XREF-025", "evidenceDepth": "ED1", "reviewedCoverage": "Official summary/metadata; complete paid book not reviewed.", "currentGaepMapping": "Team interaction concepts are illustrative only.", "implementationEvidence": "Not established.", "assuranceState": "insufficient-evidence", "residualGap": "Substantive review and enterprise operating-model mapping absent.", "adoptionConsequence": "Do not prescribe organization design from this record." },